number,grade,module,week,question_stem,choice,correct_answer
577,8,2,6,12. 形成脑疝的根本条件是下列哪一条：(2.0分),A.颅内压增高 B.腰穿放液过快过多 C.过量快速输入盐水 D.高位保留灌肠 E.颅腔内各分腔压力失去均衡,E.颅腔内各分腔压力失去均衡
1285,10,2,6,39. 脑挫裂伤最多见的发生部位是：(2.0分),A.颞叶后部及其外侧面 B.额极及额叶眶面和颞极 C.头部直接打击处的同侧脑部 D.顶叶前部 E.枕极及其底部,B.额极及额叶眶面和颞极
588,8,2,6,23. 短暂性全面性遗忘症是由于哪部分脑区缺血所致？ (2.0分),A.额叶 B.顶叶 C.颞叶 D.枕叶 E.脑干,C.颞叶
928,9,2,6,5. 最易发生小脑幕切迹疝的疾病是 (2.0分),A.鞍区占位性病变 B.颞叶占位性病变 C.小脑幕下占位性病变 D.梗阻性脑积水 E.弥漫性脑水肿,B.颞叶占位性病变
590,8,2,6,25. 脑出血最常见病因是 (2.0分),A.动脉瘤  B.血液病  C.脑淀粉样血管病变  D.高血压  E.动静脉畸形 ,D.高血压 
948,9,2,6,25. 脑出血的最常见原因是(2.0分),A.高血压病和脑动脉硬化 B.血液病 C.脑动脉炎  D.血管瘤  E.脑血管畸形,A.高血压病和脑动脉硬化
