number,grade,module,week,question_stem,choice,correct_answer
833,9,2,4,10. 男性患者，75 岁，双眼视力下降3 年，既往史：糖尿病20 年。查体：视力右眼0.3，左眼0.02，不能矫正；右眼底后极部可见多数小出血点和棉绒斑和微血管瘤。左眼虹膜新生血管（+），玻璃体内积血。.右眼诊断首先考虑(2.0分),A.年龄相关性黄斑变性 B.糖尿病视网膜病变 C.高血压性视网膜病变 D.视网膜中央静脉阻塞 E.肾病性视网膜病变,B.糖尿病视网膜病变
1533,11,2,4,5. 男性患者，55 岁，双眼视力下降1 年，既往史：糖尿病10年。查体：矫正视力右眼0.3，左眼指数/眼前；右眼后极部视网膜可见多数小出血点和棉绒斑和微血管瘤。左眼玻璃体内积血。.右眼诊断首先考虑(3.0分),A.年龄相关性黄斑变性 B.糖尿病视网膜病变 C.高血压性视网膜病变 D.视网膜中央静脉阻塞 E.肾病性视网膜病变,B.糖尿病视网膜病变
198,7,2,4,48. 化脓性脑膜炎的脑脊液检查特点： (2.0分),A.糖明显下降，氯化物下降，蛋白明显升高，细胞数升高，以淋巴增高为主 B.糖明显下降，氯化物下降，蛋白明显升高，细胞数升高，以中性粒细胞为主 C.糖正常，氯化物升高，蛋白明显下降，细胞数升高，以中性粒细胞为主 D.细胞数增高，淋巴为主，糖正常，氯化物正常，蛋白升高 E.糖明显升高，氯化物正常，蛋白正常，细胞数正常,B.糖明显下降，氯化物下降，蛋白明显升高，细胞数升高，以中性粒细胞为主
2205,13,2,4,22. 电光性眼炎是哪种辐射引起(2.5分),A.紫外线辐射 B.红外线辐射 C.激光 D.微波 E.以上都不是,A.紫外线辐射
158,7,2,4,8. 按色觉三原色学说，三种视锥细胞分别敏感的颜色是(2.0分),A.红、蓝、紫 B.红、黄、黑 C.红、绿、蓝 D.绿、蓝、白 E.红、白、青,C.红、绿、蓝
515,8,2,4,33. 中枢神经系统结核病最常见的是： (2.0分),A.结核性脑炎  B.结核性脑膜炎 C.结核性脑脊髓炎 D.结核性脑膜脑炎 E.结核性脊髓炎,B.结核性脑膜炎
2947,15,2,4,50. 睫状充血与结膜充血的鉴别，说法错误的是(2.0分),A.睫状充血以角膜缘血管为主 B.结膜充血以穹窿部血管为主 C.眼表点用肾上腺素后，睫状充血减轻，结膜充血改变不明显 D.睫状充血颜色多暗红，结膜充血颜色多鲜红 E.睫状充血多无分泌物，结膜充血常有分泌物,B.结膜充血以穹窿部血管为主
2189,13,2,4,6. 病毒性脑膜炎最常见的病原体是(2.5分),A.柯萨奇病毒 B.肠道病毒  C.单纯疱疹病毒  D.带状疱疹病毒  E.以上都不是,B.肠道病毒 
1887,12,2,4,35. 6个月患儿，发热咳嗽5天，近一日呕吐，喷射状，抽搐二次，静点抗生素3天，查体嗜睡，前囟饱满，两肺闻及少许中小水泡音，X线片右下肺少许斑片状阴影，血常规白细胞14.8×10的9次方/L，淋巴31%，脑脊液检查外观混浊，白细胞500×10的6次方/L，蛋白阳性，糖、氯化物均下降，作OT试验，硬结直径为0.5cm。(2.5分),A.结核性脑膜炎 B.病毒性脑膜炎 C.肺炎双球菌脑膜炎 D.流行性乙型脑炎 E.肺炎，中毒性脑病,C.肺炎双球菌脑膜炎
2929,15,2,4,32. 碱性烧伤的特点为： (2.0分),A.使组织蛋白凝固坏死 B.使组织坏死  C.能溶解脂肪和蛋白质，使细胞分解坏死 D.使角膜上皮点状脱落  E.破坏内皮细胞的脂肪外膜,C.能溶解脂肪和蛋白质，使细胞分解坏死
2912,15,2,4,15. 以下哪项不属于脑膜炎病因(2.0分),A.梅毒螺旋体  B.病毒 C.肿瘤脑膜转移 D.脑梗死 E.化疗,D.脑梗死
2549,14,2,4,7. 下列哪项不是头颅的痛敏结构(2.0分),A.脑组织 B.头皮 C.颅骨骨膜 D.颅底硬脑膜 E.迷走神经 ,A.脑组织
172,7,2,4,22. 诊断结核性脑膜炎的金标准是： (2.0分),A.脑脊液中细胞数增多，蛋白质增高，糖和氯化物降低 B.脑脊液中结核菌培养阳性       C.脑脊液中结核抗体阳性 D.血中抗结核抗体阳性           E.PPD皮试阳性,B.脑脊液中结核菌培养阳性      
1889,12,2,4,37. 男性，8岁。于8月19日开始发热，头痛，当时测体温38℃，在外院诊断为上感，给予布洛芬退热，头孢菌素静滴无效，8月22日出现嗜睡，体温高达40℃，8月23日因昏迷伴抽出入院。查体：神志不清，压眶有反应，体温无出血点，颈强阳性，克氏症、布氏症阴性。近期有结核患者接触史。为快速诊断应首选下列检查中的(2.5分),A.结核菌素试验 B.血常规 C.胸片 D.脑脊液常规 E.大便常规,D.脑脊液常规
2573,14,2,4,31. 眼球中起暗房作用的是(2.0分),A.视网膜 B.角膜和巩膜 C.角膜 D.巩膜 E.葡萄膜,E.葡萄膜
2560,14,2,4,18. 最常见的葡萄膜病变是(2.0分),A.葡萄膜炎    B.葡萄膜原发性肿瘤    C.葡萄膜继发性肿瘤  D.葡萄膜退行性变 E.葡萄膜先天异常,A.葡萄膜炎   
1169,10,2,4,13. 关于葡萄膜的解剖、生理和病理特点，下列哪项有误 (2.0分),A.葡萄膜由虹膜、睫状体和脉络膜组成 B.葡萄膜又称色素膜、血管膜 C.葡萄膜炎是最常见的葡萄膜病变 D.葡萄膜是眼免疫性疾病的好发部位 E.葡萄膜炎继发青光眼时可滴匹罗卡品眼药水控制眼压,E.葡萄膜炎继发青光眼时可滴匹罗卡品眼药水控制眼压
2574,14,2,4,32. 屈光系统不包括下列哪一项(2.0分),A.晶状体 B.角膜 C.房水 D.虹膜 E.玻璃体,D.虹膜
2944,15,2,4,47. 葡萄膜的组成，正确的是(2.0分),A.角膜、虹膜、脉络膜 B.虹膜、睫状体、视网膜 C.虹膜、视网膜、脉络膜 D.角膜、虹膜、视网膜 E.虹膜、睫状体、脉络膜,E.虹膜、睫状体、脉络膜
1860,12,2,4,8. 虹膜炎继发性青光眼是由于 (2.5分),A.玻璃体大量炎症细胞 B.房水分泌过多 C.血-房水屏障功能破坏 D.虹膜周边前粘连、瞳孔闭锁 E.炎症反复发作使房角后退,D.虹膜周边前粘连、瞳孔闭锁
1538,11,2,4,10.  "D"字形瞳孔可见于(3.0分),A.眼球穿孔伤 B.角膜溃疡穿孔 C.睫状体脱离 D.虹膜根部离断  E.房角后退,D.虹膜根部离断 
3643,17,2,4,44. 前葡萄膜炎发生的部位是(2.0分),A.睫状体扁平部 B.玻璃体基底部  C.虹膜睫状体 D.脉络膜 E.巩膜,C.虹膜睫状体
859,9,2,4,36. 下面哪种方法可以明确诊断白内障: (2.0分),A.验光        B.视觉诱发电位        C.干涉光断层扫描        D.裂隙灯显微镜        E.视野检查     ,D.裂隙灯显微镜       
3641,17,2,4,42. 原发性急性闭角型青光眼的眼球结构特点不包括(2.0分),A.眼球偏小  B.眼轴偏短 C.前房浅   D.房角窄 E.角膜前突,E.角膜前突
1543,11,2,4,15. 入射光线的折射主要发生在(3.0分),A.晶状体前表面 B.晶状体后表面 C.角膜前表面 D.角膜后表面 E.玻璃体前表面,C.角膜前表面
2946,15,2,4,49. KP是指(2.0分),A.角膜内皮细胞  B.角膜混浊  C.角膜后沉淀物 D.前房渗出物  E.防水闪灰,C.角膜后沉淀物
193,7,2,4,43. 有关晶状体的叙述，错误的是(2.0分),A.所视物体近移时，曲率增大 B.调节能力与弹性无关 C.近点距离的远近受其调节能力所决定 D.随着年龄的增大，弹性逐渐减退 E.近点越近，调节能力越强,B.调节能力与弹性无关
2926,15,2,4,29. 眶蜂窝织炎处理最重要的是： (2.0分),A.治疗原发灶 B.积极手术 C.适当的皮质激素治疗  D.足量的广谱抗生素 E.局部加强用眼液、眼膏抗炎 ,D.足量的广谱抗生素
2188,13,2,4,5. 下列组织中，哪项是脑膜炎的疾病部位 (2.5分),A.硬脑膜  B.软脑膜  C.蛛网膜  D.硬脑膜和软脑膜  E.软脑膜和蛛网膜,E.软脑膜和蛛网膜
2566,14,2,4,24. 女性，32岁，双眼睁不开1个月，半月前出现复视，以上症状晨起较轻，劳累或傍晚加重，眼睑检查发现双眼上睑不能上举，睑裂5mm，双眼视力1.0。诊断时应考虑以下哪种疾病可能(2.0分),A.交感神经麻痹 B.动眼神经麻痹 C.内眦赘皮 D.重症肌无力 E.先天性上睑下垂,D.重症肌无力
2922,15,2,4,25. 睑腺炎最常见的致病菌是：(2.0分),A.链球菌 B.金黄色葡萄球菌  C.莫－阿双杆菌 D.真菌 E.绿脓杆菌,B.金黄色葡萄球菌 
2578,14,2,4,36. 支配眼睑闭合的神经是(2.0分),A.动眼神经 B.交感神经 C.面神经 D.三叉神经 E.滑车神经,C.面神经
3296,16,2,4,27. 眼睑闭合不全的最常见原因是： (2.0分),A.甲状腺病性突眼 B.瘢痕性睑外翻  C.全身麻醉时 D.面神经麻痹 E.眼眶肿瘤,D.面神经麻痹
489,8,2,4,7. 关于脑膜炎双球菌不正确的： (2.0分),A.奈瑟菌属 B.严格的需氧菌 C.仅存在于人体的细菌 D.革兰阳性菌 E.在普通培养基上不能生长,D.革兰阳性菌
1158,10,2,4,2. 典型偏头痛的先兆症状可能是由于(2.0分),A.颅外动脉收缩 B.颅外动脉扩张 C.颅内动脉收缩 D.颅内动脉扩张 E.颅内和颅外动脉扩张,C.颅内动脉收缩
2550,14,2,4,8. 慢性头痛伴有颅高压症状的最有可能的病变(2.0分),A.蛛网膜下腔出血 B.偏头痛 C.颅内肿瘤  D.椎基底动脉供血不足 E.脑外伤后遗症,C.颅内肿瘤 
