,grade,module,week,question_stem,choice,correct_answer
2631,14,5,4,14. 下列哪组病毒都通过粪-口途径传播(2.5分),A.脊髓灰质炎病毒、甲型肝炎病毒、ECHO病毒、柯萨奇病毒 B.腺病毒、EB病毒、脊髓灰质炎病毒、ECHO病毒 C.柯萨奇病毒、甲型肝炎病毒、麻疹病毒、EB病毒 D.冠状病毒、腮腺炎病毒、ECHO病毒、柯萨奇病毒 E.EB病毒、ECHO病毒、脊髓灰质炎病毒、柯萨奇病毒,
2632,14,5,4,15. 脊髓灰质炎病毒主要侵犯(2.5分),A.三叉神经节 B.脑神经节 C.脊髓前角神经细胞    D.神经肌肉接头 E.海马回椎体细胞,
2633,14,5,4,16. 下列不属于虫媒传播的病毒是(2.5分),A.日本脑炎病毒 B.新疆出血热病毒 C.登革病毒  D.乙型肝炎病毒 E.森林脑炎病毒,
2634,14,5,4,17. 主要通过伊蚊传播的病毒是(2.5分),A.日本脑炎病毒 B.新疆出血热病毒 C.登革病毒 D.汉坦病毒 E.森林脑炎病毒,
2635,14,5,4,18. 流行性乙型脑炎的传播媒介是(2.5分),A.蚊子 B.蜱虫 C.白蛉 D.幼猪 E.鼠,
2636,14,5,4,19. 关于汉坦病毒，哪项是错误的(2.5分),A.为有包膜的RNA病毒 B.主要通过蚊虫叮咬传播 C.可引起肾综合症出血热 D.其基因组在病毒粒子里分三个节段,
2637,14,5,4,20. 下面哪组中的病毒均可以导致胎儿先天畸形 (2.5分),A.柯萨奇病毒、流感病毒、腮晾炎病毒 B.水痘带状疱疹病毒、巨细胞病毒、单纯疱疹病毒 C.HIV、乙利脑炎病毒、丙型肝炎病毒 D.巨细胞病毒、腺病毒，乙型肝炎病毒,
2638,14,5,4,21. 下面哪种病毒不是疫源性病毒? (2.5分),A.寨卡病毒 B.埃博拉病毒 C.巨细胞病毒 D.汉坦病毒,
2639,14,5,4,22. Which of the following is the major causal agent for nasopharyngeal carcinoma? (2.5分),A.Herpes simplex virus B.Epstein-Barr virus C.Hantavirus D.Varicella-zoster virus,
2640,14,5,4,23. Varicella is transmitted primarily by(2.5分),A.Respiratory droplets B.Sexual contact C.Body fluids D.Direct skin contact,
2641,14,5,4,24. Which one of the following outcomes is MOST common following a primary herpes simplex virus infection?(2.5分),A.Complete eradication of virus and virus infected cells B.Persistent asymptomatic viremia C.Establishment of latent infections in neurons D.Persistent cytopathic effect in infected cells,
2642,14,5,4,25. Which of the following groups are at increased risk for herpes zoster? (2.5分),A.Persons at advanced age  B.Patients with atopic dermatitis C.Pregnant women D.Persons who have been vaccinated with varicella vaccine E.Infants with congenital infections,
2643,14,5,4,26. Which one of the following is the best explanation for the selective action of acyclovir in herpes simplex virus (HSV)-infected cells? (2.5分),"A.Acyclovir binds specifically to viral receptors only on the surface of the HSV-infected cell. B.Acyclovir is phosphorylated by a virus-encoded phosphokinase only within HSV-infected cells. C.Acyclovir selectively inhibits the RNA polymerase in the HSV virion. D.Acyclovir specifically blocks the matrix protein of HSV, thereby preventing release of progeny HSV",
2644,14,5,4,"27. A 55-year-old female presents to the hospital with shortness of breath, fever, and malaise. She has a history of breast cancer, which was diagnosed 3 months ago, and has been treated with chemotherapy. Her chest x-ray shows possible pneumonia, and respiratory cultures are positive for Aspergillus fumigatus. Which of the following is the MOST appropriate choice for treatment? (2.5分)",A.Voriconazole. B.Fluconazole. C.Flucytosine. D.Ketoconazole.,
2645,14,5,4,28. A 56-year-old female with diabetes presents for routine foot evaluation with her podiatrist. The patient complains of thickening of the nail of the right big toe and a change in color (yellow). The podiatrist diagnoses the patient with onychomycosis of the toenails. Which of the following is the most appropriate choice for treating this infection? (2.5分),A.Terbinafine. B.Micafungin. C.Itraconazole. D.Griseofulvin.,
2646,14,5,4,29. A 75-year-old man with chronic obstructive pulmonary disease is diagnosed with suspected influenza based on his complaints of flu-like symptoms that began 24 hours ago. Which of the following agents is most appropriate to initiate for the treatment of influenza? (2.5分),A.Ribavirin. B.Oseltamivir. C.Zanamivir. D.Rimantadine. E.Amantadine.,
2647,14,5,4,30. A 24-year-old female is diagnosed with genital herpes simplex virus infection. Which of the following agents is indicated for use in this diagnosis? (2.5分),A.Valacyclovir. B.Cidofovir. C.Ganciclovir. D.Zanamivir. E.Lamivudine.,
2648,14,5,4,31. A female patient who is being treated for chronic hepatitis B develops nephrotoxicity while on treatment. Which is the most likely medication she is taking for HBV treatment? (2.5分),A.Entecavir. B.Telbivudine. C.Lamivudine. D.Adefovir.,
2649,14,5,4,32. 肾综合征出血热的最主要病变器官在(2.5分),A.肝 B.肾 C.肺 D.心,
2650,14,5,4,33. 典型的肾综合征出血热的临床表现，有如下几期经过： (2.5分),A.发热期，肾功能损害期，少尿期，多尿期，恢复期 B.发热初期，极期，低血压休克期，少尿期，恢复期 C.发热期，低血压休克期，少尿期，多尿期，恢复期 D.发热期，少尿期，低血压休克期，多尿期，恢复期,
2651,14,5,4,34. 对肾综合征出血热确诊最有诊断价值的实验室检查结果是(2.5分),A.血常规WBC总数高，并有异常淋巴细胞 B.尿常规蛋白（++）以上 C.外周血凝血功能下降，血小板数降低明显 D.血清肾综合征出血热特异抗体IgM阳性,
2652,14,5,4,35. 肾综合征出血热少尿期错误的治疗措施为(2.5分),A.稳定人体内环境 B.促进利尿 C.导泻和透析 D.利巴韦林（病毒唑）和短期大剂量激素治疗,
2653,14,5,4,36. 流行性乙型脑炎导致死亡的主要原因为(2.5分),A.高热 B.抽搐 C.循环功能衰竭 D.呼吸功能衰竭,
2654,14,5,4,37. 流行性乙型脑炎治疗重点是(2.5分),A.对症支持治疗 B.抗病毒治疗 C.免疫调节治疗 D.中医中药治疗,
2655,14,5,4,38. 流行性乙型脑炎预防的主要措施为(2.5分),A.预防接种疫苗 B.灭蚊防蚊、预防接种疫苗为主的综合措施 C.早期发现和隔离病人 D.加强对易感家畜尤其是猪的管理,
2656,14,5,4,39. 血凝和血凝抑制试验的原理是(2.5分),A.病毒的粘附力 B.细胞膜的选择性 C.特异性受体结合病毒 D.病毒融合细胞 E.病毒的红细胞凝集现象,
2657,14,5,4,40. 关于病毒血凝抑制试验，以下叙述不正确的是(2.5分),A.是一种非特异性的方法 B.是检测血凝抑制抗体的方法 C.所用抗体为中和抗体 D.是检测血凝素的方法之一 E.可用于病毒分型及亚型,
2921,15,5,4,1. 造成流感世界性大流行的原因是(2.5分),A.病毒抗原结构复杂                      B.抗原性漂移 C.抗原性转换        D.病毒型别较多 E.NP抗原易发生改变,
2922,15,5,4,2. 麻疹病毒的特点是(2.5分),A.感染率低、发病率低 B.目前尚不能进行组织培养 C.有多个血清型 D.感染会形成二次病毒血症，感染后机体有牢固免疫力 E.不侵犯中枢神经系统,
2923,15,5,4,3. 对流感病毒血凝素和神经氨酸酶的错误叙述是(2.5分),A.两者都是糖蛋白            B.存在于脂类包膜上 C.抗原性都很稳定            D.血凝素抗体在抗感染免疫中起主要作用 E.神经氨酸酶抗体可抑制流感病毒的播散,
2924,15,5,4,4. 流行性腮腺炎的病原体属于(2.5分),A.呼吸道病毒 B.肠道病毒 C.痘类病毒    D.疱疹病毒 E.黄病毒,
2925,15,5,4,5. 关于病毒核酸的叙述错误的是(2.5分),A.由RNA或DNA组成          B.控制病毒的遗传和变异 C.决定病毒包膜所有成分的形成        D.RNA携带病毒的遗传信息 E.决定病毒的感染性,
2926,15,5,4,6. 病毒感染宿主细胞后可出现 (2.5分),A.细胞溶解死亡 B.细胞融合 C.细胞转化   D.包涵体形成 E.以上均可,
2927,15,5,4,7. 用于估计病毒感染性强弱和数量的实验方法(2.5分),A.蚀斑形成试验 B.TCID50或ID50测定  C.ELLSA   D.PCR E.原位杂交,
2928,15,5,4,8. 检测减毒抗体的三种方法是(2.5分),A.中和试验、补体结合试验、血凝抑制试验 B.中和试验、补体结合试验、血凝试验    C.酶联免疫吸附试验、PCR、血凝抑制试验        D.中和试验、血凝试验、免疫电泳技术 E.酶联免疫吸附试验、PCR、凝胶免疫扩散试验,
2929,15,5,4,9. 下面哪种病毒与其他几种病毒在生物学性状方面差别较大(2.5分),A.首尔病毒 B.克里米亚-刚果出血热病毒 C.汉滩病毒 D.埃博拉病毒,
2930,15,5,4,10. 下面哪组中的病毒均可以导致胎儿先天畸形(2.5分),A.柯萨奇病毒、流感病毒、腮晾炎病毒 B.水痘带状疱疹病毒、巨细胞病毒、单纯疱疹病毒 C.HIV、乙利脑炎病毒、丙型肝炎病毒 D.巨细胞病毒、腺病毒，乙型肝炎病毒,
2931,15,5,4,11. HSV-1、HSV-2、EB病毒潜伏感染时的主要存在部位是(2.5分),A.三叉神经节、骶神经节、B淋巴细胞 B.疱疹复发部位局部淋巴结、迷走神经节、骶神经节 C.疱疹复发部位神经末梢、三叉神经节、T淋巴细胞 D.骶神经节、颈上神经节、嗜中性粒细胞,
2932,15,5,4,12. 肾综合征出血热的主要传染源是(2.5分),A.肾综合征出血热患者 B.蚊子 C.鼠 D.疫水,
2933,15,5,4,13. 肾综合征出血热发热期中毒症状的"三痛"，主要是指(2.5分),A.头痛，腹痛，腰痛 B.头痛，腰痛，眼眶痛 C.头痛，颈痛，腰痛 D.头痛，腿痛，淋巴结痛,
2934,15,5,4,14. 对肾综合征出血热确诊最有诊断价值的实验室检查结果是(2.5分),A.血常规WBC总数高，并有异常淋巴细胞 B.尿常规蛋白（++）以上 C.外周血凝血功能下降，血小板数降低明显 D.血清肾综合征出血热特异抗体IgM阳性,
2935,15,5,4,15. 流行性乙型脑炎的主要传染源是(2.5分),A.流行性乙型脑炎患者 B.鼠 C.猪 D.蚊子,
2936,15,5,4,16. 流行性乙型脑炎有早期诊断意义的血清学试验是(2.5分),A.补体结合试验 B.血凝抑制试验 C.中和试验 D.特异性IgM抗体试验,
2937,15,5,4,17. 关于流行性感冒病毒下列哪项是正确的(2.5分),A.流行性感冒病毒属副粘液病毒 B.分甲、乙、丙三型 C.甲型不变异 D.乙型及丙型可感染人类及多种动物,
2938,15,5,4,18. 流行性感冒的确诊的主要依据是(2.5分),A.发病季节 B.呼吸道症状轻微而全身中毒症状重 C.病毒分离 D.血凝抑制试验,
2939,15,5,4,19. 流行性感冒的临床表现，下列不符合的是(2.5分),A.全身症状重 B.上呼吸道卡他症状较轻或不明显 C.年老患者或免疫力低下的患者感染流感，病情可持续发展 D.肺外合并症多见,
2940,15,5,4,20. 流行性感冒的确诊办法(2.5分),A.发病季节 B.呼吸道症状轻微而全身中毒症状重 C.病毒分离 D.血凝抑制试验,
2941,15,5,4,21. 流行性感冒病毒分为甲、乙、丙三型的依据(2.5分),A.所致疾病的临床特征 B.流行特征 C.病毒内部和外部抗原结构不同 D.表面抗原血凝素,
2942,15,5,4,22. 创伤导致的死亡总数为（），是第（）位的死亡原因(2.5分),A.9%；五 B.19%；三 C.9%；三 D.19%；五,
2943,15,5,4,23. 以下哪项不是休克的临床表现(2.5分),A.呼吸急促 B.意识障碍、嗜睡 C.心动过度 D.毛细血管充盈时间延长 E.少尿甚至无尿,
2944,15,5,4,24. 严重创伤的全身创伤检查正确的是(2.5分),A.主要检查头颈部损伤 B.发现有血胸，以立即处理 C.发现有张力性气胸，应立即处理 D.发现骨盆有不稳定性，再次体检确认,
2945,15,5,4,25. 创伤患者病史不作为必须情况了解的是(2.5分),A.过敏史 B.当前药物使用史 C.最后进餐情况 D.创伤现场情况 E.职业暴露史,
2946,15,5,4,26. 在抢救现场或伤员刚送到急诊室时应(2.5分),A.病史采集 B.全面而详细的检查 C.迅速判断有无威胁生命的征象 D.心电监护，建立静脉通路 E.以上均是,
2947,15,5,4,27. 下列哪项不是经口气管插管的适应症(2.5分),A.严重的颅脑外伤（GCS评分＜8分）  B.急性呼吸窘迫综合症（ARDS）引起严重低氧血症 C.吸入性气道损伤 D.上呼吸道完全梗阻 E.C3/4水平颈椎骨折,
2948,15,5,4,28. 根据推敲可能性模型，以下不属于外周途径沟通的广告形式是(2.5分),A.请明星代言   B.朗朗上口的广告词 C.夸赞商品功能    D.优美动听的背景音乐,
2949,15,5,4,29. 以下不属于医务人员言语沟通的是(2.5分),A.运用得体的称呼语 B.多用称赞的语言 C.语言表达简洁明确 D.经常微笑,
2950,15,5,4,30. 关于倾听，以下不正确的是(2.5分),A.倾听是对各种听觉刺激的接收、注意和解读意义的过程 B.理解性倾听是倾听并理解信息 C.最高层次的倾听是共情的倾听 D.倾听时应不打岔、不驳斥、不续话,
2951,15,5,4,31. 以下哪一项不属于有效的治疗性倾听者合适的行为(2.5分),A.全神贯注 B.表现专注行为 C.提供分析和建议 D.营造支持性的沟通氛围,
2952,15,5,4,32. 以下哪一项不是治疗性倾听中合适的倾听态度(2.5分),A.安静的倾听 B.提供反馈 C.用重述表达共情   D.提供安慰,
2953,15,5,4,33. Which of the following antifungal agents is MOST likely to cause renal insufficiency? (2.5分),A.Fluconazole. B.Amphotericin B. C.Itraconazole. D.Posaconazole.,
2954,15,5,4,34. Which of the following antifungal agents should be avoided in patients with evidence of ventricular dysfunction?(2.5分),A.Micafungin. B.Itraconazole. C.Terbinafine. D.Posaconazole.,
2955,15,5,4,35. A 56-year-old female with diabetes presents for routine foot evaluation with her podiatrist. The patient complains of thickening of the nail of the right big toe and a change in color (yellow). The podiatrist diagnoses the patient with onychomycosis of the toenails. Which of the following is the most appropriate choice for treating this infection? (2.5分),A.Terbinafine. B.Micafungin. C.Itraconazole. D.Griseofulvin.,
2956,15,5,4,"36. A 30-year-old male patient with human immunodeficiency virus infection is being treated with a HAART (highly active antiretroviral therapy) regimen. Four weeks after initiating therapy, he presents to the emergency department complaining of fever, rash, and gastrointestinal upset. Which one of the following drugs is most likely the cause of his symptoms? (2.5分)",A.Zidovudine. B.Nelfinavir. C.Abacavir. D.Efavirenz. E.Darunavir.,
2957,15,5,4,37. A 75-year-old man with chronic obstructive pulmonary disease is diagnosed with suspected influenza based on his complaints of flu-like symptoms that began 24 hours ago. Which of the following agents is most appropriate to initiate for the treatment of influenza?(2.5分),A.Ribavirin. B.Oseltamivir. C.Zanamivir. D.Rimantadine. E.Amantadine.,
2958,15,5,4,38. A 24-year-old female is diagnosed with genital herpes simplex virus infection. Which of the following agents is indicated for use in this diagnosis?(2.5分),A.Valacyclovir. B.Cidofovir. C.Ganciclovir. D.Zanamivir. E.Lamivudine.,
2959,15,5,4,39. Congenital infection is most commonly caused by(2.5分),A.Varicella-zoster virus B.Herpes simplex virus type 2 C.Human herpesvirus 8 (Kaposi sarcoma herpesvirus) D.Cytomegalovirus E.Parvovirus,
2960,15,5,4,40. Which of the following is the major causal agent for nasopharyngeal carcinoma?(2.5分),A.Herpes simplex virus B.Epstein-Barr virus C.Hantavirus D.Varicella-zoster virus E.Cytomegalovirus,
