,grade,module,week,question_stem,choice,correct_answer
2585,14,5,5,8. 下列哪种情况需怀疑颈椎损伤可能(2.5分),A.机动车事故中受伤者 B.钝性颅脑外伤昏迷患者 C.外伤后颈部或背部疼痛 D.外伤后主诉肢体麻木无力感 E.以上都是,
2586,14,5,5,9. 下列关于张力性气胸的描述不正确的是(2.5分),A.可以以休克作为首发症状，表现为低血压，脉搏细速等 B.需要拍摄胸片确诊后减压 C.胸腔穿刺减压选择患侧锁骨中线第二肋间 D.查体通常有气管偏移，颈静脉怒张，患侧胸廓饱满，呼吸音减弱甚至消失 E.加大呼吸支持会导致病情恶化,
2587,14,5,5,10. 腹部闭合性损伤快速评估首选(2.5分),A.全腹部CT或增强CT B.床旁FAST C.诊断性腹腔灌洗 D.诊断性剖腹探查 E.仔细的腹部体检,
2588,14,5,5,11. 女，28岁，车祸致头部着地，昏迷，GCS评分11分，以下现场急救处理不正确的是(2.5分),A.颈托保护 B.评估患者呼吸循环是否稳定 C.转运至创伤中心进一步治疗 D.保温措施 E.评估是否存在其余部位的损伤,
2589,14,5,5,12. 男，23岁，车祸致方向盘撞击胸部半小时。查体：BP 80/67mmHg，P 120次/分，R 33次/分，SpO2 91%。烦躁，颈静脉怒张；双肺呼吸音粗，对称；心音听诊不明显。胸部带状软组织挫伤。胸片提示多发肋骨骨折。正确的处理是(2.5分),A.立即完善头颅，颈椎，腹部，骨盆及四肢的检查 B.立即建立静脉通路，补液抗休克治疗 C.立即予面罩吸氧，呼吸支持 D.胸带固定胸廓，并予止痛治疗 E.行床边FAST检查，观察胸腔及心包情况,
2590,14,5,5,13. 麻疹合并肺炎应隔离至(2.5分),A.出疹后3天　 B.出疹后5天　　 C.出疹后7天　　 D.出疹后10天　　 E.出疹后14天,
2591,14,5,5,14. 水痘的隔离期为(2.5分),A.皮疹全部结痂为止 B.出疹后5天　　 C.出疹后10天　　 D.出疹后14天　　 E.出疹后3周,
2592,14,5,5,15. 麻疹具有传染性的时间是(2.5分),A.潜伏期至出疹后5天 B.潜伏期至出疹后10灭 C.出疹前5天至出疹后5天 D.接触麻疹后7天至出疹后10天 E.接触麻疹后5天至出疹后5天,
2593,14,5,5,16. 下列哪个不是先天性风疹综合征的常见表现： (2.5分),A.未成熟儿 B.先天性心脏病 C.手足徐动 D.白内障 E.耳聋,
2594,14,5,5,17. Sylvia has recently learned she has cancer. She has a family history of this same type of cancer. Her doctor orders microsatellite instability testing on tumor tissue after Sylvia's surgery to remove her cancer. What inherited cancer syndrome does her doctor suspect in Sylvia's family?(2.5分),A.Hereditary breast and ovarian cancer  B.Hereditary nonpolyposis colon cancer  C.Familial adenomatous polyposis (FAP)  D.Li-Fraumeni syndrome  E.Neurofibromatosis ,
2595,14,5,5,18. Which of the following is NOT a characteristic of tumor suppressor genes?(2.5分),A.Transmitted as dominant traits in families. B.May be associated with loss of heterozygosity in tumors. C.Act dominantly in tumor cells. D.Associated with "two-hit" model of carcinogenesis.,
2596,14,5,5,19. 哪一项 HBV 血清标志物反映乙肝传染性强(2.5分),A.HBeAg(+) ； B.HBsAg(+) ； C.抗 -HBe(+) ； D.抗 -HBs(+). ,
2597,14,5,5,20. 具保护作用的乙肝病毒抗体是(2.5分),A.抗 -HBc； B.抗 -HBe； C.抗 -HBs ； D.抗 -S1 ； E.抗 -S2. ,
2598,14,5,5,21. 以下那一项不是急性重型乙型肝炎（暴发性肝炎）的临床表现(2.5分),A.极度疲乏； B.深度黄疸； C.有出血倾向； D.恶心呕吐； E.大量腹水 ,
2599,14,5,5,22. 以下哪项不是慢性肝炎肝功能重度损伤的指标 (2.5分),A.ALT>10 倍增高； B.TBIL>85.5 umol/L ； C.A/G ≤ 0.9 ； D.凝血酶原活动度（%） 71-79. ,
2600,14,5,5,23. 淤胆型肝炎除血凝血酶原活动度正常外，临床症状特点为(2.5分),A.黄疸重，自觉症状重； B.黄疸重，自觉症状轻； C.黄疸轻，自觉症状轻； D.黄疸轻，自觉症状重 .,
2601,14,5,5,24. 哪种药物可用于乙型肝炎的的病原治疗？ (2.5分),A.氧氟沙星； B.利巴韦林； C.吡喹酮； D.氯喹； E.干扰素 .,
2602,14,5,5,25. 目前世界上流行的轮状病毒主要是(2.5分),A.A组 B.B组 C.C组 D.D组,
2603,14,5,5,26. 轮状病毒引起的腹泻，主要属于(2.5分),A.渗出性腹泻 B.渗透性腹泻 C.分泌性腹泻 D.动力性腹泻,
2604,14,5,5,27. 临床脱水评估（CDS）结果提示中重度脱水(2.5分),A.0 B.3 C.4 D.6,
2605,14,5,5,28. 高渗性脱水时，血钠浓度为(2.5分),A.>140mmol/L B.>145mmol/L C.>150mmol/L D.>155mmol/L,
2606,14,5,5,29. 轮状病毒感染初期没有脱水时，下列那项不正确(2.5分),A.Increase fluid intake to compensate for losses and prevent development of dehydration B.Encourage ORS C.Continuing usual feeding D.Continuing commercial juices and carbonated beverages,
2607,14,5,5,30. 被狂犬咬伤后立即接种狂犬疫苗可以防止发病是基于什么原理？(2.5分),A.狂犬病潜伏期长 B.体内可很快产生细胞免疫 C.狂犬病潜伏期短 D.体内可很快产生抗体 E.疫苗的效价较高,
2608,14,5,5,31. 关于疯牛病致病因子的叙述，错误的是(2.5分),A.是一种传染性蛋白粒子 B.化学成分容易被蛋白酶K水解    C.所致疾病类型为传染性海绵状脑病 D.可以引起人和动物的感染 E.该因子在脑组织中形成淀粉状沉着物,
2609,14,5,5,"32. HIV-1 encodes an envelope glycoprotein, gp120. Ths protein(2.5分)",A.Causes membrane fusion B.Binds to the viral receptor on the cell surface C.Is highly conserved among different isolates D.Fails to elicit neutralizing antibody E.Induces chemokine production,
2610,14,5,5,33. Which of the following viral inclusions correspond with the rabies virus?(2.5分),A.Owl's eye-intranuclear basophilic inclusion body B.Negri bodies (intracytoplasmic) in brain tissue C.Cowdry Type A intranuclear inclusion body D.Guarnieri bodies in the cytoplasm of infected cells,
2611,14,5,5,34. 大面积烧伤液体复苏时反映血容量的最敏感指标为：(2.5分),A.血压 B.心率 C.末梢循环 D.尿量 E.中心静脉压,
2612,14,5,5,35. 浅二度烧伤临床表现为：(2.5分),A.轻度疼痛 B.剧痛 C.瘙痒 D.疼痛具有放射性 E.痛觉迟钝,
2613,14,5,5,36. 烧伤最特征性的局部病理生理变化是：(2.5分),A.细小血管通透性增加 B.炎症介质的释放 C.细胞因子的产生 D.渗出液中蛋白含量与血浆相等 E.血液成分丧失,
2614,14,5,5,37. 某成年患者颜面、双手、双小腿火焰烧伤，伴痛觉迟钝，基底红白相间，其面积和深度为：(2.5分),A.27%，深II        B.21%，浅II     C.24%，深II D.21%，深II E.30%，深II,
2615,14,5,5,38. 烧伤创面感染通常以哪一种Gˉ杆菌最为常见？(2.5分),A.大肠埃希氏菌 B.铜绿假单孢菌 C.阴沟肠杆菌 D.克雷伯氏肺炎杆菌 E.链球菌,
2616,14,5,5,39. 脓毒症患者早期复苏时的目标要使中心静脉（上腔静脉）氧饱和度（SCVO2）或混合静脉氧饱和度（SVO2）分别达到： (2.5分),A.60%，50% B.65%，50% C.70%，65% D.65%，70% E.60%，75%,
2617,14,5,5,40. 脓毒症休克病人液体复苏时首选的液体是(2.5分),A.万汶 B.白蛋白 C.贺斯 D.生理盐水 E.上述所选液体均可,
2881,15,5,5,1. What organ can be infected by hepatis viruses? (2.5分),A.LIVER B.KIDNEY C.SPLEEN D.LIVER,
2882,15,5,5,2. Each of the following statements concerning hepatitis C virus (HCV) and hepatitis D virus (HDV) is correct EXCEPT: (2.5分),"A.Delta virus is a defective virus with an RNA genome B.HCV is an important causative of post-transfusion hepatitis C.HDV can be co-transmitted with HIV D.Together with HIV, HCV can coinfect peoples",
2883,15,5,5,3. Which virus seems to be prevalent in China? (2.5分),A.HIV B.HCV C.HBV D.HAV,
2884,15,5,5,4. Which one is indicator for better prognosis of hepatitis? (2.5分),A.Anti-HBc B.Anti-PreS1 C.Anti-PreS2 D.Anti-HBe,
2885,15,5,5,5. What is the major difference between the acute state and chronic state of HBV infection? (2.5分),A.Anti-HBc B.Anti-HBs C.HBsAg D.HBeAg,
2886,15,5,5,6. A 35-year-old man addicted to intravenous drugs has been a carrier of HBs antigen for(2.5分),A.HBe antigen B.Anti-HBs antibody C.Anti-HBc antibody D.Anti-delta virus antibody ,
2887,15,5,5,7. Highly active antiretroviral combination therapy for HIV infection usually includes a protease inhibitor such as saquinavir. Such a protease inhibitor(2.5分),A.Is effective against HIV-1 but not HIV-2 B.Seldom gives rise to resistant mutants of HIV C.Inhibits a late step in virus replication D.Degrades the CD4 receptor on cells,
2888,15,5,5,8. Highly active antiretroviral therapy (HAART) is less than ideal because(2.5分),A.It does not eliminate latent HIV infection B.Its cost is too great for 90% of AIDS sufferers C.It often has severe side effects D.Some HIV strains are resistant to it,
2889,15,5,5,9. A 41-year-old HIV-infected male who had refused antiretroviral therapy is diagnosed with Pneumocystis jiroveci infection. This patient(2.5分),A.Probably has a CD4 T-cell count below 200 cells/ μL B.Is at elevated risk for lung cancer C.Has a life expectancy of about 5 years D.Probably has declining levels of plasma viremia,
2890,15,5,5,10. Which of the following is a virus associated with the development of Kaposi's sarcoma? (2.5分),A.Herpes simplex virus B.Parainfluenza virus C.Coxackievirus A16 D.Human immunodeficiency virus,
2891,15,5,5,11. Each of the following enzymes is important for HIV replication EXCEPT(2.5分),A.RNA dependent RNA polymerase B.Integrase C.RNase H enzyme D.Reverse transcriptase,
2892,15,5,5,12. Which of the following individuals may be at increased risk of acquiring HIV infection? (2.5分),A.A grandmother living in the same household with a relative who is HIV-positive B.A tourist in Botswana who has sex with a prostitute C.A receptionist at an AIDS clinic in a hospital D.A teacher with an HIV-positive child in her classroom,
2893,15,5,5,13. 哪一项 HBV 血清标志物反映乙肝传染性强 (2.5分),A.HBeAg(+) ；  B.HBsAg(+) ；  C.抗 -HBe(+) ；  D.抗 -HBs(+). ,
2894,15,5,5,14. 具保护作用的乙肝病毒抗体是 (2.5分),A.抗 -HBc ；  B.抗 -HBe ；  C.抗 -HBs ；  D.抗 -S1 ； E. 抗 -S2. ,
2895,15,5,5,15. 缺陷病毒是指(2.5分),A.戊型肝炎病毒；  B.甲型肝炎病毒；  C.乙型肝炎病毒；  D.丁型肝炎病毒 ,
2896,15,5,5,16. 以下哪项不是慢性乙型肝炎病情重症化的指标 (2.5分),A.血清转氨酶（ ALT ）明显增高；  B.胆红素突然明显增高；  C.明显的肝病面容、肝掌和蜘蛛痣； D.突然出现明显的消化道症状； ,
2897,15,5,5,17. 以下那一项不是急性重型乙型肝炎（暴发性肝炎）的临床表现 (2.5分),A.极度疲乏；  B.深度黄疸；  C.有出血倾向；  D.恶心呕吐； ,
2898,15,5,5,18. 以下哪项不是慢性肝炎肝功能重度损伤的指标 (2.5分),A.ALT>10 倍增高；  B.TBIL>85.5 umol/L ；  C.A/G ≤ 0.9 ；  D.凝血酶原活动度（ % ） 71-79. ,
2899,15,5,5,19. 淤胆型肝炎的黄疸属于  (2.5分),A.溶血性黄疸；  B.肝内梗阻性黄疸；  C.肝外梗阻性黄疸；  D.体质性黄疸 . ,
2900,15,5,5,20. 轮状病毒的结构是(2.5分),A.由10个片段双链RNA组成 B.由10个片段双链DNA组成 C.由11个片段双链RNA组成 D.由11个片段双链DNA组成,
2901,15,5,5,21. 目前世界上流行的轮状病毒主要是(2.5分),A.A组 B.B组 C.C组 D.D组,
2902,15,5,5,22. 轮状病毒感染的主要传播途径为(2.5分),A.血液传播 B.接触传播 C.粪-口传播 D.呼吸道传播,
2903,15,5,5,23. WHO低渗口服补液盐配方的渗透压为 (2.5分),A.240mOsm/L B.245mOsm/L C.290mOsm/L D.311mOsm/L,
2904,15,5,5,24. 临床脱水评估（CDS）结果( )提示轻度脱水(2.5分),A.0 B.3 C.7 D.10,
2905,15,5,5,25. 等渗性脱水时，血钠浓度为 (2.5分),A.125-135mmol/L B.130-140mmol/L C.130-150mmol/L D.135-145mmol/L,
2906,15,5,5,26. 幼儿急诊临床特点是(2.5分),A.发热 B.皮疹 C.惊厥 D.热退疹出,
2907,15,5,5,27. 幼儿急诊好发年龄是(2.5分),A.＜６月龄 B.＞１５月龄 C.６－１５月龄 D.１－２岁,
2908,15,5,5,28. 水痘皮疹特征是(2.5分),A.红色斑丘疹 B.水疱疹 C.云雾状疱疹 D.以上都是,
2909,15,5,5,29. 重症新生儿水痘，发生时间最可能是(2.5分),A.新生儿出生后５－１０天 B.新生儿出生后０－７天 C.新生儿出生后１０－１４天 D.新生儿出生后１４－２１天,
2910,15,5,5,30. 发热出疹性疾病，最常见原因包括(2.5分),A.病毒感染 B.细菌感染 C.药物过敏 D.结缔组织性疾病,
2911,15,5,5,31. 水痘的病原体为(2.5分),A.单纯疱疹病毒 B.水痘-带状疱疹病毒   C.人类疱疹病毒6型 D.柯萨奇病毒,
2912,15,5,5,32. 水痘最常见的并发症是(2.5分),A.水痘肺炎  B.水痘脑炎 C.水痘皮肤感染 D.水痘肝炎,
2913,15,5,5,33. 关于疯牛病致病因子的叙述，错误的是(2.5分),A.是一种传染性蛋白粒子            B.化学成分容易被蛋白酶K水解    C.所致疾病类型为传染性海绵状脑病            D.可以引起人和动物的感染,
2914,15,5,5,34. 对脓毒症导致的灌注不足患者，推荐在第一个3小时内至少给予多少量液体静脉输注? (2.5分),A.10 ml/kg; B.20 ml/kg; C.30 ml/kg; D.40 ml/kg;,
2915,15,5,5,35. 对需要血管活性物质的感染性休克患者，推荐的平均动脉压初始目标为多少?(2.5分),A.55 mmHg;  B.60 mmHg;  C.65 mmHg; D.70 mmHg;,
2916,15,5,5,36. 在脓毒血症及感染性休克的初始液体复苏中，推荐的液体选择？(2.5分),A.晶体液； B.胶体液； C.白蛋白； D.血制品；,
2917,15,5,5,37. 如果充分的液体复苏和升压药治疗不能很好的维持血流动力学稳定，建议静脉使用氢化可的松，其中剂量推荐为？(2.5分),A.100 mg/d； B.150 mg/d； C.200 mg/d； D.250 mg/d,
2918,15,5,5,38. 在成年脓毒症/感染性休克患者，一般在血红蛋白浓度降低到多少时才输注红细胞(RBC)?  (2.5分),A.<6.0 g/dL； B.<7.0 g/dL； C.<8.0 g/dL； D.<9.0 g/dL；,
2919,15,5,5,39. 关于成年脓毒症/感染性休克患者静脉血栓的预防，下面哪项是错误的？(2.5分),A.在无禁忌情况下，推荐使用药物 [如低分子肝素(LMWH)]预防静脉血栓； B.一般推荐使用普通肝素(UFH)预防静脉血栓； C.在可行情况下，建议使用药物与机械联合进行； D.预防过程中，可以使用床边超声进行评估；,
2920,15,5,5,40. 关于成年脓毒症/感染性休克患者抗生素的治疗，下面哪项是错误的？(2.5分),"A.对疑似脓毒症或感染性休克患者在抗生素用药前, 恰当留取病原学培养，且不能延误抗生素治疗； B.对于非感染原因所致的严重炎症状态(例如重症胰腺炎)患者,不推荐持续性全身预防性使用抗菌药物治疗； C.一旦确定病原体及药敏结果和/或临床体征充分改善, 推荐需要将经验性抗生素治疗转变为窄谱的针对性治疗； D.推荐对于脓毒症或感染性休克患者抗菌药物的优化给药策略，是基于药代动力学/药效动力学原理；",
